<?xml version="1.0" encoding="UTF-8"?>
<actions xmlns:xsi="http://www.w3.org/2001/XMLSchema-instance"
	xsi:noNamespaceSchemaLocation="rules.xsd">
	<whenPaidFor productTitle="Learning to Ski">
		<receiptFor productId="First_Aid_Id" receiver="customer" />
	</whenPaidFor>

	<whenPaidFor productType="Membership">
		<sendMessage receiver="customer">
			<message>Welcome...</message>
		</sendMessage>
	</whenPaidFor>

	<whenPaidFor productType="PhysicalProduct">
		<receiptFor product="bought" receiver="customer" />
	</whenPaidFor>

	<whenPaidFor productType="Book">
		<receiptFor product="bought" receiverId="royaltyDepartment" />
	</whenPaidFor>
</actions>